{
  "$schema": "urn:fortress:schema:v1:change",
  "schema_version": 1,
  "id": "CHG-REPOSITORY-GRAMMAR-0007",
  "status": "in-progress",
  "objective": "Converge Fortress's physical repository, declarations, documentation, verification, and placement rule to the canonical recursive Module grammar without changing product behavior or claiming certification.",
  "baseline": {
    "commit": "919b9fe14ab6b1b69cd5f61a2bc2ebef621bdc20",
    "branch": "dev"
  },
  "authority_refs": [
    "README.md",
    "mods/engine/README.md",
    "mods/engine/mods/standard_registry/README.md",
    "mods/engine/mods/snapshot_governance/README.md",
    "mods/cli/README.md",
    "mods/testing/README.md"
  ],
  "scope": [
    "canonical recursive Module grammar",
    "Cargo 1.97 manifest, target, lockfile, and build-output compatibility",
    "functional engine and CLI Module hierarchy",
    "localized verification Modules and conformance Data",
    "distributed schemas, standard rules, and project declarations",
    "recursive repository grammar evaluation",
    "documentation convergence and legacy-root removal",
    "Fortress self-audit under the converged structure"
  ],
  "checks": [
    {
      "command": "cargo fmt --check",
      "status": "pending",
      "summary": "Validate canonical Rust formatting through the relocated workspace manifest."
    },
    {
      "command": "cargo clippy --workspace --all-targets -- -D warnings",
      "status": "pending",
      "summary": "Validate warnings-denied Rust analysis through the relocated workspace manifest."
    },
    {
      "command": "cargo test --workspace",
      "status": "pending",
      "summary": "Validate implementation, conformance, recursive grammar, and self-model behavior."
    },
    {
      "command": "cargo doc --workspace --no-deps",
      "status": "pending",
      "summary": "Validate warnings-denied Rust documentation through the relocated workspace manifest."
    },
    {
      "command": "fortress audit --format json",
      "status": "pending",
      "summary": "Require the converged physical tree and implemented Snapshot Governance rules to pass without upgrading certification state."
    }
  ],
  "decisions": [
    "Cargo 1.97.1 is the minimum compatible toolchain because resolver.lockfile-path became stable in Cargo 1.97.",
    "Cargo manifests are authored Data; Cargo.lock is Cargo-maintained derived Info; build output remains transient outside the governed Module tree.",
    "GitHub-recognized root community-health and workflow surfaces remain explicit root exceptions; no ecosystem-wide exception is granted to Cargo files."
  ],
  "deferred_capabilities": [
    "full Fortress certification and attestation",
    "onboarding or migration-phase activation machinery"
  ],
  "result": {
    "certification_claim": "NOT CERTIFIED",
    "commit": null,
    "note": "Structural convergence evidence is development evidence and must not be represented as certification."
  }
}
