{
  "$schema": "../../../schemas/v1/change.schema.json",
  "schema_version": 1,
  "id": "CHG-TEMPORAL-0002",
  "status": "archived",
  "objective": "Generalize the initial temporal change schema so ordinary changes do not require bootstrap packet provenance.",
  "baseline": {
    "commit": "4a45c20c9e04a3998dd1a54211c2783530a67a1c",
    "branch": "dev"
  },
  "authority_refs": [
    "docs/governance/temporal.md",
    "docs/architecture/contracts.md",
    "docs/standard/philosophy.md"
  ],
  "scope": [
    "schemas/v1/change.schema.json",
    ".fortress/changes/archive/2026/CHG-BOOTSTRAP-0001.json",
    "schema registry tests",
    "temporal foundation documentation"
  ],
  "checks": [
    { "command": "JSON structural parsing", "status": "passed", "summary": "All 25 tracked JSON contract, fixture, and self-model documents parsed." },
    { "command": "cargo fmt --all --check", "status": "passed", "summary": "All Rust source is deterministically formatted." },
    { "command": "cargo clippy --workspace --all-targets --all-features -- -D warnings", "status": "passed", "summary": "Workspace analysis passed with warnings denied." },
    { "command": "cargo test --workspace --all-targets --all-features", "status": "passed", "summary": "All 29 tests passed, including general change-schema and self-model checks." },
    { "command": "RUSTDOCFLAGS=-D warnings cargo doc --workspace --all-features --no-deps", "status": "passed", "summary": "Workspace documentation built with warnings denied." }
  ],
  "decisions": [],
  "deferred_capabilities": [
    "typed temporal record loader",
    "change lifecycle transitions and authorization",
    "change-scope drift detection",
    "transition certification"
  ],
  "result": {
    "certification_claim": "NOT CERTIFIED",
    "commit": "3392fd4845b00813ad8080350b6b80c1bfceef24",
    "note": "The implementation commit is recorded exactly. This archival-only follow-up preserves the temporal record; ordinary tests are not certification evidence."
  }
}
