{
  "$schema": "../../../../schemas/v1/change.schema.json",
  "schema_version": 1,
  "id": "CHG-OBSERVATION-0003",
  "status": "archived",
  "objective": "Implement deterministic universal repository file observation as the next prerequisite for declared-versus-observed architecture and contract evaluation.",
  "baseline": {
    "commit": "b1abea783e87740751e3883f5bcd0760121fc365",
    "branch": "dev"
  },
  "authority_refs": [
    "docs/architecture/system.md",
    "docs/architecture/adapters.md",
    "docs/onboarding/governance.md",
    "docs/standard/philosophy.md"
  ],
  "scope": [
    "repository observation schema",
    "provider-independent recursive file inventory",
    "SHA-256 file facts",
    "explicit exclusion policy",
    "positive, negative, boundary, determinism, and self-application tests",
    "self-model ownership and certification scaffolding"
  ],
  "checks": [
    { "command": "JSON structural parsing", "status": "passed", "summary": "All 27 current JSON contract, standard, fixture, and self-model documents parsed." },
    { "command": "cargo fmt --all --check", "status": "passed", "summary": "All Rust source is deterministically formatted." },
    { "command": "cargo clippy --workspace --all-targets --all-features -- -D warnings", "status": "passed", "summary": "Workspace analysis passed with warnings denied after resolving two findings without exemptions." },
    { "command": "cargo test --workspace --all-targets --all-features", "status": "passed", "summary": "All 35 tests passed, including observation positive, boundary, determinism, exclusion, and self-application evidence." },
    { "command": "RUSTDOCFLAGS=-D warnings cargo doc --workspace --all-features --no-deps", "status": "passed", "summary": "Workspace documentation built with warnings denied." },
    { "command": "cargo metadata --locked --no-deps --format-version 1", "status": "passed", "summary": "The committed lockfile resolves the new SHA-256 dependency without mutation." }
  ],
  "decisions": [],
  "deferred_capabilities": [
    "gitignore and version-control-aware scope",
    "stable snapshot or change-during-read detection",
    "symbol, import, package, language, and framework observation",
    "declared-versus-observed reconciliation",
    "observation persistence and CLI exposure"
  ],
  "result": {
    "certification_claim": "NOT CERTIFIED",
    "commit": "4c5bebcd11051ef52a1bbdc0000137a0cabdbc84",
    "note": "The implementation commit is recorded exactly. This archival-only follow-up preserves the temporal record; observed facts are not certification evidence."
  }
}
